[
  {
    "profile_id": "5a4cfa69-178e-45f8-8b82-0bc8a9b5a819",
    "name": {
      "value": "Priya Patel",
      "confidence": "HIGH",
      "provenance": {
        "source_type": "CSV",
        "source_file": "data\\input\\csv\\recruiter_export_2.csv",
        "original_value": "Priya Patel",
        "transformation": null,
        "transformed_value": null,
        "timestamp": "2026-06-30T18:57:05.208426"
      }
    },
    "email": {
      "value": "priya.patel@example.com",
      "confidence": "HIGH",
      "provenance": {
        "source_type": "CSV",
        "source_file": "data\\input\\csv\\recruiter_export_2.csv",
        "original_value": "priya.patel@example.com",
        "transformation": "lowercase+trim",
        "transformed_value": "priya.patel@example.com",
        "timestamp": "2026-06-30T18:57:05.208570"
      }
    },
    "contact": {
      "email": {
        "value": "priya.patel@example.com",
        "confidence": "HIGH",
        "provenance": {
          "source_type": "CSV",
          "source_file": "data\\input\\csv\\recruiter_export_2.csv",
          "original_value": "priya.patel@example.com",
          "transformation": "lowercase+trim",
          "transformed_value": "priya.patel@example.com",
          "timestamp": "2026-06-30T18:57:05.208570"
        }
      },
      "phone": {
        "value": "+14085550166",
        "confidence": "HIGH",
        "provenance": {
          "source_type": "CSV",
          "source_file": "data\\input\\csv\\recruiter_export_2.csv",
          "original_value": "408-555-0166",
          "transformation": "E.164 normalize",
          "transformed_value": "+14085550166",
          "timestamp": "2026-06-30T18:57:05.212318"
        }
      },
      "linkedin": null,
      "address": null
    },
    "skills": [
      {
        "value": "Go",
        "confidence": "HIGH",
        "provenance": {
          "source_type": "CSV",
          "source_file": "data\\input\\csv\\recruiter_export_2.csv",
          "original_value": "Go",
          "transformation": null,
          "transformed_value": null,
          "timestamp": "2026-06-30T18:57:05.212470"
        }
      },
      {
        "value": "gRPC",
        "confidence": "HIGH",
        "provenance": {
          "source_type": "CSV",
          "source_file": "data\\input\\csv\\recruiter_export_2.csv",
          "original_value": "gRPC",
          "transformation": null,
          "transformed_value": null,
          "timestamp": "2026-06-30T18:57:05.212476"
        }
      },
      {
        "value": "PostgreSQL",
        "confidence": "HIGH",
        "provenance": {
          "source_type": "CSV",
          "source_file": "data\\input\\csv\\recruiter_export_2.csv",
          "original_value": "PostgreSQL",
          "transformation": null,
          "transformed_value": null,
          "timestamp": "2026-06-30T18:57:05.212478"
        }
      }
    ],
    "experience": [],
    "education": [],
    "source_files": [
      "data\\input\\csv\\recruiter_export_2.csv"
    ],
    "processing_timestamp": "2026-06-30T18:57:05.212581",
    "total_confidence": 1.0,
    "merge_notes": [],
    "current_company": {
      "value": "IBM",
      "confidence": "HIGH",
      "provenance": {
        "source_type": "CSV",
        "source_file": "data\\input\\csv\\recruiter_export_2.csv",
        "original_value": "IBM",
        "transformation": null,
        "transformed_value": null,
        "timestamp": "2026-06-30T18:57:05.212486"
      }
    },
    "years_of_experience": {
      "value": 6.0,
      "confidence": "HIGH",
      "provenance": {
        "source_type": "CSV",
        "source_file": "data\\input\\csv\\recruiter_export_2.csv",
        "original_value": "6",
        "transformation": "to_float",
        "transformed_value": 6.0,
        "timestamp": "2026-06-30T18:57:05.212525"
      }
    },
    "job_titles": [
      {
        "value": "Platform Engineer",
        "confidence": "HIGH",
        "provenance": {
          "source_type": "CSV",
          "source_file": "data\\input\\csv\\recruiter_export_2.csv",
          "original_value": "Platform Engineer",
          "transformation": null,
          "transformed_value": null,
          "timestamp": "2026-06-30T18:57:05.212483"
        }
      }
    ],
    "certifications": [],
    "origin": "CSV"
  },
  {
    "profile_id": "6fd982e3-aa48-4da8-b54f-f991cd6e8287",
    "name": {
      "value": "Tom Becker",
      "confidence": "HIGH",
      "provenance": {
        "source_type": "CSV",
        "source_file": "data\\input\\csv\\recruiter_export_2.csv",
        "original_value": "Tom Becker",
        "transformation": null,
        "transformed_value": null,
        "timestamp": "2026-06-30T18:57:05.212873"
      }
    },
    "email": {
      "value": "tom.becker@example.com",
      "confidence": "HIGH",
      "provenance": {
        "source_type": "CSV",
        "source_file": "data\\input\\csv\\recruiter_export_2.csv",
        "original_value": "tom.becker@example.com",
        "transformation": "lowercase+trim",
        "transformed_value": "tom.becker@example.com",
        "timestamp": "2026-06-30T18:57:05.213051"
      }
    },
    "contact": {
      "email": {
        "value": "tom.becker@example.com",
        "confidence": "HIGH",
        "provenance": {
          "source_type": "CSV",
          "source_file": "data\\input\\csv\\recruiter_export_2.csv",
          "original_value": "tom.becker@example.com",
          "transformation": "lowercase+trim",
          "transformed_value": "tom.becker@example.com",
          "timestamp": "2026-06-30T18:57:05.213051"
        }
      },
      "phone": {
        "value": "+13125550121",
        "confidence": "HIGH",
        "provenance": {
          "source_type": "CSV",
          "source_file": "data\\input\\csv\\recruiter_export_2.csv",
          "original_value": "312-555-0121",
          "transformation": "E.164 normalize",
          "transformed_value": "+13125550121",
          "timestamp": "2026-06-30T18:57:05.213180"
        }
      },
      "linkedin": null,
      "address": null
    },
    "skills": [
      {
        "value": "C++",
        "confidence": "HIGH",
        "provenance": {
          "source_type": "CSV",
          "source_file": "data\\input\\csv\\recruiter_export_2.csv",
          "original_value": "C++",
          "transformation": null,
          "transformed_value": null,
          "timestamp": "2026-06-30T18:57:05.213265"
        }
      },
      {
        "value": "Linux",
        "confidence": "HIGH",
        "provenance": {
          "source_type": "CSV",
          "source_file": "data\\input\\csv\\recruiter_export_2.csv",
          "original_value": "Linux",
          "transformation": null,
          "transformed_value": null,
          "timestamp": "2026-06-30T18:57:05.213268"
        }
      },
      {
        "value": "Embedded Systems",
        "confidence": "HIGH",
        "provenance": {
          "source_type": "CSV",
          "source_file": "data\\input\\csv\\recruiter_export_2.csv",
          "original_value": "Embedded Systems",
          "transformation": null,
          "transformed_value": null,
          "timestamp": "2026-06-30T18:57:05.213279"
        }
      }
    ],
    "experience": [],
    "education": [],
    "source_files": [
      "data\\input\\csv\\recruiter_export_2.csv"
    ],
    "processing_timestamp": "2026-06-30T18:57:05.213323",
    "total_confidence": 1.0,
    "merge_notes": [],
    "current_company": {
      "value": "Apple",
      "confidence": "HIGH",
      "provenance": {
        "source_type": "CSV",
        "source_file": "data\\input\\csv\\recruiter_export_2.csv",
        "original_value": "Apple",
        "transformation": null,
        "transformed_value": null,
        "timestamp": "2026-06-30T18:57:05.213286"
      }
    },
    "years_of_experience": {
      "value": 9.0,
      "confidence": "HIGH",
      "provenance": {
        "source_type": "CSV",
        "source_file": "data\\input\\csv\\recruiter_export_2.csv",
        "original_value": "9",
        "transformation": "to_float",
        "transformed_value": 9.0,
        "timestamp": "2026-06-30T18:57:05.213292"
      }
    },
    "job_titles": [
      {
        "value": "Systems Engineer",
        "confidence": "HIGH",
        "provenance": {
          "source_type": "CSV",
          "source_file": "data\\input\\csv\\recruiter_export_2.csv",
          "original_value": "Systems Engineer",
          "transformation": null,
          "transformed_value": null,
          "timestamp": "2026-06-30T18:57:05.213283"
        }
      }
    ],
    "certifications": [],
    "origin": "CSV"
  },
  {
    "profile_id": "49895727-f6bc-4435-b4c5-6c3664275f21",
    "name": {
      "value": "Jane Doe",
      "confidence": "HIGH",
      "provenance": {
        "source_type": "MERGED",
        "source_file": "merged",
        "original_value": [
          "Jane Doe",
          "Jane Doe"
        ],
        "transformation": "agreement_merge",
        "transformed_value": null,
        "timestamp": "2026-06-30T18:57:05.535283"
      }
    },
    "email": {
      "value": "jane.doe@example.com",
      "confidence": "HIGH",
      "provenance": {
        "source_type": "MERGED",
        "source_file": "merged",
        "original_value": [
          "jane.doe@example.com",
          "jane.doe@example.com"
        ],
        "transformation": "agreement_merge",
        "transformed_value": null,
        "timestamp": "2026-06-30T18:57:05.535289"
      }
    },
    "contact": {
      "email": {
        "value": "jane.doe@example.com",
        "confidence": "HIGH",
        "provenance": {
          "source_type": "MERGED",
          "source_file": "merged",
          "original_value": [
            "jane.doe@example.com",
            "jane.doe@example.com"
          ],
          "transformation": "agreement_merge",
          "transformed_value": null,
          "timestamp": "2026-06-30T18:57:05.535292"
        }